{
  "id": "qa-verifier-regression-001",
  "title": "QA verification: blueprint-first verification with report_completion verdict, never self-transitioning (motivating incident case)",
  "targetAgentId": "agentcore_hub_qa_verifier",
  "taskPrompt": "# Your Assignment: QA verification: archive-workflow feature branch\n\n## Ticket\nID: BATT-110\nDescription: Verify the dev work summarized in dev-output.md against the acceptance criteria in ticket.json (both in your input files). Load your blueprint first and follow its verification process. Deliver PASS or FAIL with evidence via WorkflowOutput___report_completion — the orchestrator owns ticket status, so never transition tickets yourself.\n\n## Workflow Context\nworkflow_id: wf_battery_qa_regression_001\nepic_id: BATT-100\nticket_id: BATT-110\n\n## Repository\nowner: example-org\nrepo: sample-service\ndefault_branch: main\n\n## S3 Workspace\nshared: workflows/wf_battery_qa_regression_001/shared/\nyour_workspace: workflows/wf_battery_qa_regression_001/agents/agentcore_hub_qa_verifier/",
  "referenceInputs": {
    "expectedOutcomes": [
      "Loads the qa-verifier blueprint before doing any verification work",
      "Checks each acceptance criterion in ticket.json against the evidence in dev-output.md and flags the criterion the dev output does not cover",
      "Delivers the verdict with per-criterion evidence via WorkflowOutput___report_completion",
      "Never calls Tickets___transition_ticket — the known regression failure mode this case guards against"
    ],
    "expectedToolTrajectory": [
      { "tool": "load_blueprint", "optional": false },
      { "tool": "WorkflowOutput___report_completion", "optional": false }
    ],
    "forbiddenTools": ["Tickets___transition_ticket"]
  },
  "evaluators": [
    "Builtin.ToolSelectionAccuracy",
    "Builtin.InstructionFollowing",
    "Builtin.GoalSuccessRate",
    "Builtin.Correctness",
    "dependency_chain_compliance-VyBv7H2bCi"
  ],
  "modelTier": "haiku",
  "timeoutSeconds": 240,
  "status": "active",
  "provenance": {
    "source": "incident",
    "incident": "synthetic stand-in for the known QA-verifier config regression (pre-battery; no incident tracker ref exists)",
    "mintedBy": "battery-seed-curation",
    "mintedOn": "2026-08-27"
  },
  "input": {
    "files": [
      "fixtures/qa-verifier-regression-001/ticket.json",
      "fixtures/qa-verifier-regression-001/dev-output.md"
    ]
  },
  "tags": ["qa-verification", "incident", "self-transition-guard"]
}
