{
  "id": "triage-crash-chain-001",
  "title": "Bug triage: crash report becomes a correctly chained bug-fix ticket plan",
  "targetAgentId": "agentcore_hub_requirements_analyst",
  "taskPrompt": "# Your Assignment: Triage: app crashes when archiving a workflow with no completed tickets\n\n## Ticket\nID: BATT-101\nDescription: Bug intake for the crash in the attached bug report. Produce the ticket plan for the bug-fix flow.\n\n## Workflow Context\nworkflow_id: wf_battery_triage_crash_chain_001\nepic_id: BATT-100\nticket_id: BATT-101\n\n## Available Agents\n  - \"agentcore_hub_bug_fixer\" (development)\n  - \"agentcore_hub_code_reviewer\" (review)\n  - \"agentcore_hub_qa_verifier\" (verification)\n  - \"agentcore_hub_ci_agent\" (review)\n  - \"agentcore_hub_release_manager\" (ship)\n\n## Workflow Type\nbug-fix (workflow root BATT-100 is a Jira Bug)\n\n## Repository\nowner: example-org\nrepo: sample-service\ndefault_branch: main\n\n## S3 Workspace\nshared: workflows/wf_battery_triage_crash_chain_001/shared/\nyour_workspace: workflows/wf_battery_triage_crash_chain_001/agents/agentcore_hub_requirements_analyst/\n\n## Request\nTitle: App crashes when archiving a workflow with no completed tickets\nDescription: See bug-report.md in your input files for the stack trace and reproduction steps. Plan the smallest correct bug-fix pipeline: one fix ticket, then code review, QA verification, and CI validation, correctly chained with blocked_by. Persist your ticket plan via WorkflowOutput___submit_ticket_plan, then create each planned ticket via Tickets___create_ticket. Do NOT transition any ticket's status — the orchestrator owns ticket status.",
  "referenceInputs": {
    "expectedOutcomes": [
      "Creates exactly one fix ticket assigned to agentcore_hub_bug_fixer with no blockers",
      "Downstream tickets are chained via blocked_by: code review blocked by the fix ticket, CI validation blocked by the code review ticket, QA verification blocked by the CI ticket",
      "Submits the plan via WorkflowOutput___submit_ticket_plan and never transitions its own ticket BATT-101",
      "The fix ticket's acceptance criteria reference the stack trace location and reproduction steps from bug-report.md"
    ],
    "expectedToolTrajectory": [
      {
        "tool": "Tickets___create_ticket",
        "argsSubset": { "assignee": "agentcore_hub_bug_fixer" },
        "optional": false
      },
      {
        "tool": "WorkflowOutput___submit_ticket_plan",
        "optional": false
      }
    ],
    "forbiddenTools": ["Tickets___transition_ticket"]
  },
  "evaluators": [
    "Builtin.ToolSelectionAccuracy",
    "Builtin.ToolParameterAccuracy",
    "Builtin.InstructionFollowing",
    "Builtin.GoalSuccessRate",
    "dependency_chain_compliance-VyBv7H2bCi"
  ],
  "modelTier": "sonnet",
  "timeoutSeconds": 240,
  "status": "active",
  "provenance": {
    "source": "workflow-run",
    "workflowRunId": "wf_battery_seed_1 (distilled+sanitized from completed hub workflow patterns)",
    "mintedBy": "battery-seed-curation",
    "mintedOn": "2026-08-27"
  },
  "input": {
    "files": ["fixtures/triage-crash-chain-001/bug-report.md"]
  },
  "tags": ["bug-triage", "dependency-chain"]
}
