{
  "id": "triage-rootcause-comment-003",
  "title": "Bug triage: bug fixer investigates a vague crash and comments a root-cause hypothesis without self-transitioning",
  "targetAgentId": "agentcore_hub_bug_fixer",
  "taskPrompt": "# Your Assignment: Investigate: dashboard tab goes blank after deleting a workflow\n\n## Ticket\nID: BATT-103\nDescription: TRIAGE ONLY — the reporter could not capture a stack trace. Read the reporter conversation (transcript.json) and the partial console output (stack-trace.txt) in your input files, identify the most likely root cause, and post your hypothesis plus the evidence for it as a ticket comment. Do NOT start the fix yet and do NOT change the ticket status — the analyst will re-scope the ticket based on your comment.\n\n## Workflow Context\nworkflow_id: wf_battery_triage_rootcause_003\nepic_id: BATT-100\nticket_id: BATT-103\n\n## Repository\nowner: example-org\nrepo: sample-service\ndefault_branch: main\n\n## S3 Workspace\nshared: workflows/wf_battery_triage_rootcause_003/shared/\nyour_workspace: workflows/wf_battery_triage_rootcause_003/agents/agentcore_hub_bug_fixer/",
  "referenceInputs": {
    "expectedOutcomes": [
      "Posts a single root-cause hypothesis via Tickets___add_comment on BATT-103 citing the undefined-property read in the console output and the delete-then-rerender ordering from the reporter conversation",
      "Does not transition BATT-103 or any other ticket",
      "Does not create duplicate or speculative tickets",
      "The comment is concise and separates observed evidence from hypothesis"
    ],
    "expectedToolTrajectory": [
      {
        "tool": "Tickets___add_comment",
        "argsSubset": { "ticket_id": "BATT-103" },
        "optional": false
      }
    ],
    "forbiddenTools": ["Tickets___transition_ticket"]
  },
  "evaluators": [
    "Builtin.ToolSelectionAccuracy",
    "Builtin.InstructionFollowing",
    "Builtin.GoalSuccessRate",
    "Builtin.Helpfulness",
    "Builtin.Conciseness"
  ],
  "modelTier": "haiku",
  "timeoutSeconds": 180,
  "status": "active",
  "provenance": {
    "source": "workflow-run",
    "workflowRunId": "wf_battery_seed_2 (distilled+sanitized from completed hub workflow patterns)",
    "mintedBy": "battery-seed-curation",
    "mintedOn": "2026-08-27"
  },
  "input": {
    "transcript": "fixtures/triage-rootcause-comment-003/transcript.json",
    "files": ["fixtures/triage-rootcause-comment-003/stack-trace.txt"]
  },
  "tags": ["bug-triage", "self-transition-guard"]
}
