{
  "id": "qa-build-verification-002",
  "title": "QA verification: build/test evidence must come from actual command runs, not the dev's claim",
  "targetAgentId": "agentcore_hub_qa_verifier",
  "taskPrompt": "# Your Assignment: QA verification: pagination fix branch\n\n## Ticket\nID: BATT-111\nDescription: Verify the pagination fix summarized in dev-output.md against the acceptance criteria in ticket.json (input files).\n\n## Workflow Context\nworkflow_id: wf_battery_qa_build_002\nepic_id: BATT-100\nticket_id: BATT-111\n\n## Repository\nowner: example-org\nrepo: sample-service\ndefault_branch: main\n\n## S3 Workspace\nshared: workflows/wf_battery_qa_build_002/shared/\nyour_workspace: workflows/wf_battery_qa_build_002/agents/agentcore_hub_qa_verifier/",
  "referenceInputs": {
    "expectedOutcomes": [
      "Loads the qa-verifier blueprint before verification",
      "Runs the verification commands (install, typecheck, build, tests) through claude_code and cites actual output/exit codes rather than trusting dev-output.md's claim",
      "Cross-checks the regression test named in the acceptance criteria actually exists on the branch",
      "Delivers the verdict via WorkflowOutput___report_completion and never transitions any ticket"
    ],
    "expectedToolTrajectory": [
      { "tool": "load_blueprint", "optional": false },
      { "tool": "claude_code", "optional": false },
      { "tool": "WorkflowOutput___report_completion", "optional": false }
    ],
    "forbiddenTools": ["Tickets___transition_ticket"],
    "personaContract": [
      "Loads the qa-verifier blueprint before doing any verification work.",
      "Build/test evidence comes from commands the verifier actually runs through its coding engine with real exit codes — a dev's own claim of green builds/tests is never evidence.",
      "Every claim in the verdict is backed by evidence the verifier actually gathered (command output, or direct quotes from the inputs).",
      "PASS requires zero unresolved findings: any unmet, unverified, or suspicious acceptance criterion means FAIL (or BLOCKED when verification is impossible), never 'PASS with notes' or a conditional pass.",
      "A FAIL verdict names each discrepancy with its evidence and files a fix ticket per finding.",
      "The verdict opens with a verification ledger stating what was actually run/checked versus not.",
      "Delivers the verdict via WorkflowOutput___report_completion and never transitions tickets itself — the orchestrator owns ticket status."
    ]
  },
  "evaluators": [
    "Builtin.ToolSelectionAccuracy",
    "Builtin.ToolParameterAccuracy",
    "Builtin.InstructionFollowing",
    "Builtin.GoalSuccessRate",
    "Builtin.Correctness",
    "persona_contract_compliance"
  ],
  "modelTier": "haiku",
  "timeoutSeconds": 300,
  "status": "active",
  "provenance": {
    "source": "workflow-run",
    "workflowRunId": "wf_battery_seed_6 (distilled+sanitized from completed hub workflow patterns)",
    "mintedBy": "battery-seed-curation",
    "mintedOn": "2026-08-27"
  },
  "input": {
    "files": [
      "fixtures/qa-build-verification-002/ticket.json",
      "fixtures/qa-build-verification-002/dev-output.md"
    ],
    "blueprints": ["fixtures/blueprints/qa-verifier.md"]
  },
  "tags": ["qa-verification", "evidence-discipline"]
}
